{
  "schemaVersion": 1,
  "inventoryVersion": "2026-09-05.3",
  "profiles": [
    "this-machine"
  ],
  "features": {
    "aur": true,
    "bluetooth": true,
    "development": true,
    "gaming": true,
    "media-production": true,
    "printing": false,
    "scanning": false,
    "tailscale": true,
    "virtualisation-guest": true
  },
  "packages": {
    "include": [
      "libva-utils"
    ],
    "exclude": [
      "chromium",
      "evince",
      "foot",
      "jetbrains-toolbox",
      "kdenlive",
      "localsend",
      "moonlight-qt",
      "pacsea-bin",
      "parsec-bin",
      "ruby",
      "tmux",
      "xournalpp",
      "yt-dlp",
      "zbar"
    ],
    "aur": [
      "anydesk-bin",
      "beekeeper-studio-bin",
      "brave-bin",
      "cliamp",
      "hyprmoncfg-bin",
      "paru",
      "parui",
      "tensaku",
      "try",
      "ttf-ia-writer",
      "tzupdate",
      "ufw-docker",
      "vesktop-bin",
      "visual-studio-code-bin",
      "yay"
    ]
  },
  "notes": {}
}
